{
  "id": "patience-beats-talent",
  "level": 3,
  "topic": "Self Development",
  "title": "What Outlasts Talent",
  "titleKr": "재능보다 멀리 가는 인내",
  "sentences": [
    {
      "text": "Two classmates who started the same violin class in March now sound completely different.",
      "chunks": [
        {
          "en": "Two classmates",
          "kr": "두 반 친구는"
        },
        {
          "en": "who started the same violin class in March",
          "kr": "3월에 같은 바이올린 수업을 시작한"
        },
        {
          "en": "now sound completely different.",
          "kr": "이제 완전히 다르게 들린다"
        }
      ],
      "naturalTranslation": "3월에 같은 바이올린 수업을 시작한 두 반 친구의 연주가 이제는 완전히 다르게 들린다.",
      "wordOrderPoint": {
        "title": "긴 주어 뒤에서 진짜 동사 찾기",
        "explanation": "관계절이 끼어들어 주어가 길어져도 이 문장의 동사는 sound 하나뿐입니다."
      },
      "breakRules": {
        "allowed": [],
        "discouraged": [
          {
            "boundary": 2,
            "reason": "관계대명사 who와 그 동사 started를 갈라 읽지 않습니다."
          },
          {
            "boundary": 7,
            "reason": "짧은 전치사구 in March는 앞의 class에 붙여 읽습니다."
          },
          {
            "boundary": 8,
            "reason": "전치사 in과 목적어 March를 갈라놓지 않습니다."
          },
          {
            "boundary": 11,
            "reason": "동사 sound와 보어 completely different를 갈라 읽지 않습니다."
          }
        ]
      },
      "grammar": [
        {
          "label": "주격 관계대명사 who",
          "note": "who started the same violin class in March가 앞의 Two classmates를 꾸밉니다."
        },
        {
          "label": "감각동사 sound + 형용사 보어",
          "note": "sound 뒤에는 부사가 아니라 형용사 different가 와서 '~하게 들리다'가 됩니다."
        }
      ],
      "words": [
        {
          "word": "sound",
          "meaning": "~하게 들리다"
        }
      ],
      "insight": {
        "formula": "[주어 Two classmates (who started ... in March)] + [부사 now] + [동사 sound] + [보어 completely different]",
        "why": "who로 시작하는 관계절이 주어 뒤에 통째로 끼어들어도 주절의 동사는 sound 하나입니다. sound는 상태를 전하는 동사라 뒤에 형용사를 붙여 씁니다.",
        "wrong": "Two classmates who started the same violin class in March now sound completely differently.",
        "natural": "3월에 같은 바이올린 수업을 시작한 두 반 친구의 연주가 이제는 완전히 다르게 들린다."
      }
    },
    {
      "text": "One of them was praised early for her quick progress, and she soon stopped practicing at home.",
      "chunks": [
        {
          "en": "One of them was praised early",
          "kr": "그들 중 한 명은 일찍 칭찬을 받았다"
        },
        {
          "en": "for her quick progress,",
          "kr": "그녀의 빠른 진전 덕분에"
        },
        {
          "en": "and she soon stopped practicing at home.",
          "kr": "그리고 그녀는 곧 집에서 연습하기를 멈췄다"
        }
      ],
      "naturalTranslation": "그들 중 한 명은 빠른 진전 덕분에 일찍 칭찬을 받았고, 곧 집에서 연습하기를 멈췄다.",
      "wordOrderPoint": {
        "title": "one of them은 단수 취급",
        "explanation": "주어가 One이라 복수 them이 뒤에 있어도 동사는 단수형 was를 씁니다."
      },
      "breakRules": {
        "allowed": [
          {
            "boundary": 14,
            "reason": "문장 끝의 짧은 부사구 at home 앞에서는 끊어 읽어도 자연스럽습니다."
          }
        ],
        "discouraged": [
          {
            "boundary": 1,
            "reason": "전치사 of와 목적어 them을 갈라놓지 않습니다."
          },
          {
            "boundary": 3,
            "reason": "수동태의 was와 과거분사 praised는 한 덩어리라 갈라 읽지 않습니다."
          },
          {
            "boundary": 13,
            "reason": "stopped와 그 목적어 practicing을 갈라 읽지 않습니다."
          }
        ]
      },
      "grammar": [
        {
          "label": "수동태 be + 과거분사",
          "note": "was praised - 칭찬을 한 사람보다 칭찬을 받은 사실을 앞세웁니다."
        },
        {
          "label": "stop + -ing",
          "note": "stopped practicing - 하던 연습 자체를 그만두었다는 뜻입니다."
        },
        {
          "label": "등위접속사 and로 두 절 잇기",
          "note": "and가 칭찬받은 일과 연습을 멈춘 일을 나란히 잇습니다."
        }
      ],
      "words": [
        {
          "word": "was praised",
          "meaning": "칭찬을 받았다"
        },
        {
          "word": "progress",
          "meaning": "실력이 느는 것, 진전"
        }
      ]
    },
    {
      "text": "The other kept working through small mistakes, repeating each hard measure until it felt easy.",
      "chunks": [
        {
          "en": "The other kept working",
          "kr": "다른 한 명은 계속해 나갔다"
        },
        {
          "en": "through small mistakes,",
          "kr": "작은 실수들을 겪으면서"
        },
        {
          "en": "repeating each hard measure",
          "kr": "어려운 마디를 하나하나 반복하며"
        },
        {
          "en": "until it felt easy.",
          "kr": "그것이 쉬워질 때까지"
        }
      ],
      "naturalTranslation": "다른 한 명은 작은 실수를 겪으면서도, 어려운 마디를 쉬워질 때까지 반복하며 계속해 나갔다.",
      "wordOrderPoint": {
        "title": "keep + -ing로 이어 가기",
        "explanation": "kept working은 그만두지 않고 하던 일을 계속 밀고 나갔다는 뜻입니다."
      },
      "breakRules": {
        "allowed": [],
        "discouraged": [
          {
            "boundary": 1,
            "reason": "짧은 주어 The other와 동사 kept를 갈라놓지 않습니다."
          },
          {
            "boundary": 2,
            "reason": "kept와 working은 한 덩어리라 조동사처럼 붙여 읽습니다."
          },
          {
            "boundary": 4,
            "reason": "전치사 through와 목적어 small mistakes를 갈라놓지 않습니다."
          },
          {
            "boundary": 12,
            "reason": "짧은 주어 it과 동사 felt를 갈라놓지 않습니다."
          }
        ]
      },
      "grammar": [
        {
          "label": "분사구문(동시 동작)",
          "note": "repeating each hard measure가 주절과 동시에 일어난 동작을 덧붙입니다."
        },
        {
          "label": "시간 부사절 until",
          "note": "until it felt easy - 쉬워질 때까지 계속했다는 끝점을 나타냅니다."
        },
        {
          "label": "구동사 work through",
          "note": "work through - 어려움을 겪어 내며 해 나가다."
        }
      ],
      "words": [
        {
          "word": "kept working through",
          "meaning": "~을 겪어 내며 계속해 나갔다"
        },
        {
          "word": "measure",
          "meaning": "(악보의) 마디"
        }
      ]
    },
    {
      "text": "Six months later, the slower learner plays far more smoothly than the quick starter does.",
      "chunks": [
        {
          "en": "Six months later,",
          "kr": "여섯 달 뒤"
        },
        {
          "en": "the slower learner plays far more smoothly",
          "kr": "더 느렸던 학습자가 훨씬 더 매끄럽게 연주한다"
        },
        {
          "en": "than the quick starter does.",
          "kr": "빠르게 시작했던 사람보다"
        }
      ],
      "naturalTranslation": "여섯 달 뒤, 더 느렸던 학습자가 빠르게 시작했던 사람보다 훨씬 매끄럽게 연주한다.",
      "wordOrderPoint": {
        "title": "시간 부사구를 문두에 두기",
        "explanation": "Six months later를 맨 앞에 놓아 언제의 일인지 먼저 못 박습니다."
      },
      "breakRules": {
        "allowed": [
          {
            "boundary": 5,
            "reason": "주어 the slower learner가 세 단어로 길어 동사 앞에서 끊어 읽어도 자연스럽습니다."
          }
        ],
        "discouraged": [
          {
            "boundary": 6,
            "reason": "동사 plays와 그 정도를 말하는 far more smoothly를 갈라 읽지 않습니다."
          },
          {
            "boundary": 8,
            "reason": "비교급을 만드는 more와 smoothly를 갈라놓지 않습니다."
          },
          {
            "boundary": 13,
            "reason": "비교절의 주어 the quick starter와 대동사 does를 갈라놓지 않습니다."
          }
        ]
      },
      "grammar": [
        {
          "label": "비교급 + than 절",
          "note": "more smoothly than ~ does로 두 사람의 연주를 견줍니다."
        },
        {
          "label": "대동사 does",
          "note": "than 뒤의 does는 앞에 나온 plays를 대신해 동사를 되풀이하지 않게 합니다."
        },
        {
          "label": "비교급 강조 far",
          "note": "far more smoothly - far가 비교급을 강조해 '훨씬'을 뜻합니다."
        }
      ],
      "words": [
        {
          "word": "far more smoothly",
          "meaning": "훨씬 더 매끄럽게"
        }
      ],
      "insight": {
        "formula": "[시간 부사구 Six months later] + [주어 the slower learner] + [동사 plays] + [비교 far more smoothly than the quick starter does]",
        "why": "비교급 more smoothly 뒤의 than은 비교 대상을 절 통째로 데려옵니다. 그 절의 동사는 앞의 plays를 대신하는 대동사 does로 줄여 씁니다.",
        "wrong": "The slower learner plays far more smoothly than the quick starter is.",
        "natural": "여섯 달 뒤, 더 느렸던 학습자가 빠르게 시작했던 사람보다 훨씬 매끄럽게 연주한다."
      }
    },
    {
      "text": "At the end of class, the teacher smiles and says, \"Play that part again for us.\"",
      "chunks": [
        {
          "en": "At the end of class,",
          "kr": "수업이 끝날 무렵"
        },
        {
          "en": "the teacher smiles and says,",
          "kr": "선생님이 미소 지으며 말한다"
        },
        {
          "en": "\"Play that part again for us.\"",
          "kr": "그 부분을 우리에게 다시 연주해 보렴"
        }
      ],
      "naturalTranslation": "수업이 끝날 무렵, 선생님이 미소 지으며 말한다. 그 부분을 우리에게 다시 연주해 보렴.",
      "wordOrderPoint": {
        "title": "문두 시간 부사구로 장면 열기",
        "explanation": "At the end of class를 앞세워 이 장면이 언제인지 먼저 정해 줍니다."
      },
      "breakRules": {
        "allowed": [
          {
            "boundary": 7,
            "reason": "접속사 and 앞에서는 끊어 읽어도 자연스럽습니다."
          },
          {
            "boundary": 13,
            "reason": "문장 끝의 짧은 전치사구 for us 앞에서는 끊어 읽어도 됩니다."
          }
        ],
        "discouraged": [
          {
            "boundary": 2,
            "reason": "the end of class는 한 덩어리라 end와 of를 갈라 읽지 않습니다."
          },
          {
            "boundary": 3,
            "reason": "전치사 of와 목적어 class를 갈라놓지 않습니다."
          },
          {
            "boundary": 10,
            "reason": "명령문의 동사 Play와 목적어 that part를 갈라 읽지 않습니다."
          }
        ]
      },
      "grammar": [
        {
          "label": "명령문",
          "note": "Play that part again - 주어 없이 동사원형으로 시작해 부탁이나 지시를 나타냅니다."
        },
        {
          "label": "직접화법",
          "note": "says 뒤에 콤마를 찍고 실제로 한 말을 따옴표 안에 그대로 옮깁니다."
        },
        {
          "label": "등위접속사 and로 동사 잇기",
          "note": "smiles와 says가 같은 주어 the teacher의 연속 동작입니다."
        }
      ],
      "words": [
        {
          "word": "At the end of",
          "meaning": "~이 끝날 무렵에"
        }
      ]
    }
  ]
}